456,The synchronous speed of an induction motor is the __________.,speed at which the rotor turns,speed of the rotating field,frequency of the rotor current,slip in per cent of rotor RPM,B
457,The things to be considered to avoid shock when working on electrical jobs are                                .  I - Use hand gloves that are good conductors  II - Use electric equipment that is fully insulated  III - Avoid using equipment with open wire,I and II,II and III,I and III ,"I, II, and III",B
458,The total power used up in a series circuit is __________.,the sum of the powers used in each load (resistor) divided  by the number of loads,the sum of the powers used in each load,always less than the power used in the smallest load,never more than the power used in largest load,B
459,"The total resistance in ohms of two resistors, 60 ohms 40 ohms which are connected in parallel in an electrical circuit is _________________.",20,24,180,60,B
460,The total resistance of a parallel circuit is always _____________.,larger than that of the branch with greatest resistance,Smaller than that of the branch with the lowest resistance,Equal to the sum of the individual branch resistance,unequal to the sum of the individaul branch resistance,B
461,The type of automatic starter for direct current motors that utilizers an oil dashpot is the_______starter.,is not affected during charging,time-element,shunt current limit,series current limit,B
462,"The type of water temperature controller that uses wax and copper filled and sealed capsule to adjust a valve which allows more or less water to pass over the cooler tubes, at the same time opening or closing a bypass valve is called a _________________.",Syrex,Drayton,Foxboro,Walton,B
463,"The unit ""hertz"" is equivalent to",revolution per minute,cycles per second,revolutions per second,coulombs per second,B
464,The unit of apparent power in purely inductance and capacitance. The inductance of a coil is expressed in ___________________.,KVA,VAR,EMF,WATT ,B
465,The voltage induced in the armature windings of an AC generator is maximum when the field poles are?,in the neutral plane,opposite the armature poles,between the armature poles,rotating at a high speed,B
466,The voltage of an alternator is normally controlled by varying the _______________.,prime mover speed,rotating magnetic field,numbers of conductors,AC generators,B
467,Three wire DC generators can incorporate an unbalance of_____________.,10%,25%,5%,50%,B
468,Tightly knit metal braid wire can be used with a printed circuit board when __________.,conductor resistance is not a factor,required to desolder components on the board,electrically produced magnetic fluxes would cause inaccuracies in adjacent components,reactance in the circuit must be kept to a minimum,B
469,To dissipate internal heat in a generator it is built with_______________.,Insulation  ,Laminated cores,slip rings,none of the given answers,B
470,"To properly use a hook-on-type volt/ammeter to check current flow, you must FIRST __________.",de-energize the circuit to allow connection of the  instrument in series,hook the jaws of the instrument around the insulated conductor,connect the voltage test leads to the appropriate terminals,short the test leads and calibrate the instrument to zero,B
471,To reduce the sparkling on an interpole generator you would__________.,retard the brushes,advance the brushes,reverse the brushes,none of the given answers,B
472,"To test the state of charge of a nickel-cadmium battery, you should use a/an __________.",ammeter,voltmeter,hydrometer,potentiometer,B
473,"Two AC generators of the same capacity are operating in parallel.  One with a zero speed droop setting and the other with a 5% speed droop.  If its capacity is not exceeded, the unit whose governor has the zero speed droop setting will __________.",assume the smaller share of the load,maintain the frequency of the system,have poor sensitivity characteristics,have poor power response,B
474,"Two DC drive propulsion motors provide input to a single output reduction gear.  Upon relieving the watch, you notice that the starboard motor indicators show reduced voltage and zero current compared to normal voltage and current indicated on the port mo",a tripped reverse power relay,a tripped reverse current relay,overheating of the load inverter,a tripped variable frquency converter,B
475,"Upon failure of the normal power supply, the emergency generator is placed on the line by the ____________.",bus tie feeder,automatic bus transfer device,line connection feeder,power failure alarm bus,B
476,Voltage will always lead current in _______________________.,capacitative circuit,inductive circuit,magnetic circuit,resistive circuit,B
477,What  should you do before spraying liquid solvent on the insulation of the motor?,slow the motor down to low speed,disconnect the motor from the power source,secure ventilation in the area,preheat the insulation to assist in cleaning,B
478,What could be an application for a silicon controlled rectifier?,to provide power for a main ropulsion motor,for use as a voltage reference diode,for sensing flame is an automated burner,to eliminate power supply hum,B
479,What determines the voltage of a lead-acid cell?,the type of electrolyte,the strength of the electrolyte,the size of the plates,none of the above,B
480,What do you call the D. C. generator when the field is supplied from an external source?,Self excited,Separately excited,Shunt ,compound,B
481,What do you call the instrument being used to measure the atmospheric pressure?,Compound Gauge,Barometer,pressure gauge,Pneumercator,B
482,What do you call the magnet parts that supply the magnetic field of a generator?,Armatures,Poles,Slip rings,Brush holders,B
483,"What do you expect to happen first, during navigation when the generator engine suddenly stops in an automated vessel?",Main engine will stop,Emergency generator will start,Emergency lamps will light,Another generator will start,B
484,What happen during the charging of lead-acid storage batter?,negative plates change to lead peroxide,positive plates change to lead peroxide,both plates change to lead peroxide,both plates change to lead sulfate,B
485,What is maximum volume in % of oxygen in the inert gas when the safety alarm sounds to give an audible and visual & warming?,4,8,10,12,B
486,What is ohm's law?,The resistance is inversely proportional to the applied voltage,The impressed voltage is inversely proportional to the line current through resistance,The flow of the current is directly proportional to the resistance,The current flowing is inversely proportional to the resistance,B
487,What is the device being use to measure the suction efficiency of a running pump?,Pressure Gauge,Compound Gauge,Pneumercator,Manometer,B
488,What is the function of the interpoles installed in DC motors?,To provide greater torque by strengthening the main field.,To provide sparkless commutation without having to shift the brushes.,To limit the production of counter-electromotive force.,To limit the starting surge current.,B
489,What is the indicated if a lead-acid battery begins to gas violently when it is first put on charge?,normal charging rate,excessive charging rate,insufficient circuit in a cell,a short circuit in a cell,B
490,What is the main function in the use of a capacitor for starting a single phase motor?,Reduce radio interference,Split the phase to establish a rotating magnetic field,Reduce the phase angle,Prolong the life of the starting contacts,B
491,What is the maximum allowable primary current of a 2 KVA step-down transformer with a four to one turns ratio if the primary is connected across a 440 volt line?,1.1 amps,4.5 amps,18.1 amps,27.7 amps,B
492,What is the most common method of producing electricity for electric power use?,electrolysis,magnetism,Chemical action,Heat transfer,B
493,What is the purpose of the capacitors on the output of the power supplies used in today's consoles?,they act as a permanent,they filter out ripple,they prevent overloads,they increase the output frequency,B
494,What is the reason why there is visual spark created in the commutator of a D. C. motor?,Worn out bearing,Worn out carbon brush,Misaligned slip ring,Over loading of motor,B
495,What is the safest gas being used to cool large polyphase synchronous alternator specially fire prevention?,Carbon dioxide,Hydrogen,Carbon Monoxide ,Oxygen,B
496,What is the safety electric device that automatically breaks the current if an excessive current is drawn by the motor?,Power relay ,Overload Relay,Voltage Regulator,Load Equalizer,B
497,What is the total number of watts equivalent to drive a one horssepower motor?,500,668,746,1000,B
498,What is the value that will change if the resistors are connected in parallel in an electrical circuit is the., The motor will speed up and run out of control,Current,Impedance,Voltage,B
499,"What kind electrical switch, where a circuit is connected to one part of another circuit in one position of a switch and to another part of its circuit in the other switch position?",Multi-pole,Double throw,Double pole,Single pole,B
500,What kind of circuit protecting device where the trip mechanism is actuated by a small armature when an excessive current is sensed in the circuit?,Thermal breaker,Magnetic breaker,Safety fuse,voltage regulator,B
501,"What kind of maintenance system if equipment, engines motors are checked or overhauled as per schedule?",Breakdown,Planned,Condition,Operational,B
502,What kind of maintenance system if you repaired a cargo winch motor due to unusual sound of bearing during loading or unloading of cargo?,Operational,Condition,Planned,Breakdown,B
503,What kind of safety device having metal with low resistance valve and melting point which are designed to blow out thus opening the circuit when the current exceeds the rated valve of the resistance?,Set point,Fuse ,Breaker,Switch,B
504,What means of giving information to the crew that there is a malfunction among the machineries in an automated vessel?,sensor device,sound alarm,gong alarm,blinkering lights,B
505,What number of mouths interval should the insulation test be conducted onboard for generators and motors.,3,6,9,12,B
506,What should you do before spraying liquid solvent on the insulation of the motor?,slow the motor down to low speed,disconnect the motor from the power source,secure ventilation in the area,preheat the insulation to assist in cleaning,B
507,What type of electric motor is commonly used to start small auxiliary diesel engines?,synchronous,series,shunt,cage,B
508,"What will be the output frequency of a three-phase, six pole, AC generator operating at 1800 revolutions per minute?",60 hertz,90 hertz,120 hertz,180 hertz,B
509,What will happen if you close the circuit breakere of the incoming alternator 180 degress out of phase with loaded alternator when paralleling?,the rotor of the loaded alternator will hunt,severe cross currents will occur which could cause damage,The rotor of the incoming alternator will cop,Both alternators will parallel 180 degree out of phase,B
510,"When a controller is provided with reset rate adjustment, a change in this adjustment results in a change of the __________.",Fuse,floating rate of the proportional-speed floating component,value representing the readjusted controlled variable,desired prepositioned value of the controlled medium,B
511,"When a lead-acid cell is being charges, the current flow is____________.",the same as that,opposite to current flow,in parallel to current flow,in series with current flow,B
512,"When a megohmmeter is being used on a alternating current machine, the meter pointer will dip toward 'zero' and then gradually rise to the true resistance value if the motor insulation is __________.",grounded,good,shorted,dirty,B
513,"When changing fuses, you should always __________.",wear rubber boots,use a fuse puller,stand on a rubber mat,wear safety glasses,B
514,"When checking for a possible single phase condition in a three-phase induction motor circuit, which of the following electrical measuring devices would be the most practical to use to locate the malfunction?",Meggar,amp-probe,growler,All of the above.,B
515,"When insulation failure produces a low resistance current path between two conductors, the resulting condition is known as __________.",an open,a short circuit,a ground,a surge,B
516,"When measuring voltage across a load, you would connect a_____________.",voltmeter in series with the load,voltmeter across the load,ammeter across the load,ammeter in series with the load,B
517,"When reading electrical motor controller diagrams, it helps to know that __________.",current paths in the control circuit are drawn as heavy lines and in the power circuit as lighter lines,current paths in the power circuit are drawn as heavy lines and in control circuit as lighter lines,circuits subject to 500 volts or greater are drawn as heavy lines and below 500 volts as lighter lines,circuits subject to 500 volts or greater are drawn as light lines and below 500 volts as heavy lines,B
518,"When replacing a defective transformer in a paralleled transformer configuration, which  of the following actions must be carried out to insure proper operation of the equipment it serves?",The secondary leads must be grounded for 10 minutes to remove static charges.,The transformer connections must be made as before with regard to the indicated polarity.,The iron core of the transformer must be flashed to pre-magnetize it.,The iron core must be grounded for 10 minutes to remove any residual magnetism.,B
519,"When testing the rotor of a synchronous motor for short circuits, a low voltage source is applied across the rotor coils through the collector rings.  A coil having a short circuit will be indicated by a __________.","high voltage drop reading, while the other coil readings will have an equal or lower value","low or zero voltage drop reading, while the other coils will have higher readings","fluctuating voltmeter reading, while the other coil readings are steady","steady voltmeter reading, while the other coil readings are fluctuating",B
520,"When the lead acid batteries are charging, they give off hydrogen that is_____________.",considered inert,highly explosive,extremely toxic,heavier than air,B
521,"When used for taking resistance measurements, a volt-ohm-milliammeter is normally powered by __________.",a hand cranked generator,internal storage batteries,the current in the circuit being tested,a step down transformer,B
522,"When using a megohmmeter to test the dielectric strength of wire insulation, a continuous series of slight downscale kicks by the pointer is result of __________.",good insulation,the leakage of current along the surface of dirty insulation,the capacitance of the windings,the dielectric-absorption effect of the insulation,B
523,"When using an ohmmeter to test a semiconductor diode, you find a low resistance in both the forward and reverse bias  directions. This indicates that the diode has a/an  __________.",open,short,good resistive quality,good capacitive quality,B
524,"When using an ohmmeter to test a semiconductor diode, you find a low resistance in both the forward and reverse bias  directions. This indicates that the diode has a/an  __________.",open,short,good resistive quality,good capacitive quality,B
525,"When you are troubleshooting a DC motor fails to start, first thing to check:", Motor windings for obvious short, Fuses and circuit breaker, Motor controller leads for continuity with a megger, Motor controller leads for open with a fuses,B
526,Which meter uses a shunt connected in series with the load and parallel with the meter movement?,power factor meter,ammeter,voltmeter,wattmeter,B
527,Which of the devices listed would be considered a hydraulic system directional control valve?,Counterbalance valve,"Offset, two position valve",Sequencing valve,Unloading valve,B
528,Which of the following actions must be carried out before a voltage tester can be used to test the three line fuses to a three-phase motor?,The fuses must be removed from the circuit.,The starter must be placed in the STOP position to stop the motor.,The three line connections in the motor terminal box must be disconnected and tagged.,Nothing need be done as long as the motor is running under a light load.,B
529,Which of the following characteristics is most critical in determining the size of cable to be used in a particular circuit.,voltage rating,current rating,inductance per unit length,weight per unit length,B
530,Which of the following components are used to convert alternating current produced in the generator windings to direct current?,Armature and equalizer,Commutator and brushes,Rotor and interpoles,Field and exciter,B
531,Which of the following conditions indicates a short circuited capacitor when checking its condition with an ohmmeter?,"The capacitor shows charging, but the final resistance reading is appreciably more than normal.",The reading is practically zero and remains there.,"The capacitor shows no charging action, but indicates a very high resistance.","The pointer moves quickly to the low resistance side of the scale, then slowly recedes toward infinity.",B
532,"Which of the following control actions, when combined with  proportional-position action, will eliminate manual repositioning of the set point for each load change to produce an automatic reset action?",open field coils,Floating action,Reciprocal action,Rate action,B
533,Which of the following electrical properties listed will always be the same for each component in a parallel circuit?, resistance, voltage, current, reactance,B
534,Which of the following instruments can be used to measure the rate of air flow?,Thermometer,Anemometer,Psychrometer,Areometer,B
535,Which of the following is a characteristic of fractional  horsepower repulsion start motors?,They start with a rotating stator field.,The short circuiting ring is removed from the commutator while starting.,The brushes are removed from the commutator while starting.,They have a low starting torque.,B
536,Which of the following is not ordinarily used for determining power factor?, Wattmeter, Tachometer, Ammeter for lighting circuit, Travel meter,B
537,Which of the following is used to obtain 115 volt DC from a 240-volt DC generator_________.,an inverter,a balance coil,a balance relay,none of the given answers,B
538,Which of the following is used to obtain 115 volt DC from a 240-volt DC generator_________.,an inverter,a balance coil,a balance relay,none of the given answers,B
539,Which of the following methods should be used to test for an 'open' coil in an AC motor stator?,"Test with an ohmmeter, one test lead on the shaft, and the other test lead to the stator leads.",Test with an ohmmeter with the test leads on the disconnected stator coil leads.,"Use a growler, listening for noise and vibration to diminish when over an open coil.","Use a growler, listening for noise and vibration to increase when over an open coil.",B
540,Which of the following problems will occur if the circuit breaker of the incoming alternator is closed and it is 180° out of phase with the loaded alternator when paralleling?,The rotor of the loaded alternator will hunt.,Severe cross currents will occur which could cause damage.,The rotor of the incoming alternator will stop.,Both alternators will parallel 180° out of phase.,B
541,"Which of the following problems will occur if the internal  drain at either end of a hydraulic, two-way, spool-type directional control valve cylinder were to become plugged?",The reservoir would become vapor bound.,The valve would be placed in hydraulic lock.,The spring loaded relief ports would open.,The buffering chambers would be unable to function.,B
542,Which of the following statements best describes the material known as varnished cambric?,Felted asbestos sealed with varnish.,Cotton cloth coated with insulating varnish.,Rubber insulation coated with a layer of tin.,"Paper impregnated with mineral oil, specially wrapped with  nonmetallic tape, and coated with varnish.",B
543,Which of the following statements concerning the maintenance of solid-silver contacts in relays and auxiliary control circuits is correct?,"When necessary, they should always be dressed with a wire wheel.",They should be filed with a fine-cut file when projections  extend beyond the contact surface.,"When black silver oxide is present, it should always be removed from the contact surface with coarse sandpaper.","When necessary, they should be spray painted with electrical shellac",B
544,Which of the following statements concerning the specific gravity of a battery electrolyte is true?,The electrolyte becomes less dense when it is cooled.,The specific gravity reading is lowered when the electrolyte is heated.,The most accurate hydrometer reading is obtained immediately after water is added.,The temperature does not affect the specific gravity of the electrolyte.,B
545,Which of the following statements concerning the specific gravity of a battery electrolyte is true?,The electrolyte becomes less dense when it is cooled.,The specific gravity reading is lowered when the electrolyte is heated.,The most accurate hydrometer reading is obtained immediately after water is added.,The temperature does not affect the specific gravity of the electrolyte.,B
546,Which of the following statements correctly applies to transistors?,LED and LCD are the two basic types of transistors.,"The three terminals are called the emitter, base, and collector.",The emitter separates the base and collector.,The collector separates the emitter and base.,B
547,Which of the following statements describes the significance of ambient temperature in relation to the service life of electronic components?,Ambient temperature should be as high as possible to drive  off moisture.,Increased ambient temperature decreases the service life of electronic components.,Ambient temperature is not significant as long as the relative humidity is kept low.,A reduced ambient temperature causes a corresponding reduced service life.,B
548,Which of the following statements represents the action of a megohmmeter when testing a small capacitor in good  condition?,The meter pointer should immediately swing to the maximum resistance value for the capacitor.,The meter pointer should first swing quickly to zero and then gradually move up the scale as the capacitor charges.,The meter pointer should immediately swing to infinity and  then drop in sharp jerks as the voltage increases.,The meter pointer should immediately swing to a high reading and gradually decrease.,B
549,Which of the following statements represents the correct method of connecting the shunt of an ammeter prior to taking a reading?,In series with the load and in series with the meter movement.,In series with the load and in parallel with the meter movement.,In parallel with the load and in series with the meter movement.,In parallel with the load and in parallel with the meter movement.,B
550,Which of the following types of insulation will begin to deteriorate FIRST as a result of the heat generated in the conductor it surrounds?,Varnished cloth,Rubber,Silicon,Asbestos,B
551,Which of the following would be equipped on a 3 wire DC generator to give continues current flow?,banks of resistors ,balance coils,slip rings,none of the given answers,B
552,Which of the following would be equipped on a 3 wire DC generator to give continues current flow?,banks of resistors ,balance coils,slip rings,none of the given answers,B
553,Which of the following would you not normally find on a DC generator?,Binding wires,Slip rings,Brush holder,Air gap,B
554,Which of the instruments listed is used to check insulation resistance?,Magneto,Megohmmeter,Dynamometer,Rheostat,B
555,Which of the listed conditions describes the effect on intrinsic semiconductor operation as a result of a  temperature increase?,Capacitive reactance will decrease,Conductivity will increase,Inductive reactance will decrease,Resistivity will increase,B
556,Which of the listed conditions might contribute to the mica segments of a commutator to wear slower than the commutator bars?,aligning the from and rear mica rings improperly,using improper carbon brushes, a grounded commutator,an open circuit in the armature,B
557,Which of the listed conditions might contribute to very rapid wearing of a DC machine's commutator bars?,A grounded commutator bar,Using improper grade of carbon brushes,Aligning the front and rear mica V-rings improperly,An open circuit in the armature,B
558,Which of the listed devices may be used as a digital device?,variable resistor,diode,strain gauge,thermistor,B
559,Which of the listed faults can only be eliminated by  turning or grinding the face of a commutator with a rigidly supported tool?,Sparking brushes,Eccentricity,High mica,Incorrect brush angle,B
560,"Which of the listed faults cannot be eliminated, EXCEPT by turning or grinding a commutator with a rigidly supported tool?",Sparking brushes,Eccentricity,High mica,Blackened commutator,B
561,Which of the listed hydraulic system components could an  0-ring seal be satisfactorily used in providing a seal?,Low pressure pump shaft casing,Relief valve spool,High pressure pump shaft casing,Linear actuator w/o nylon,B
562,Which of the listed instruments can be best used to locate a grounded field coil in a synchronous motor?,Frequency meter,Megohmmeter,Voltmeter,Multimeter,B
563,Which of the listed instruments can be best used to locate a grounded field coil in a synchronous motor?,Frequency meter,Megohmmeter,Voltmeter,Multimeter,B
