804,"Which of the listed meters uses a shunt connected in series with the load, but parallel with the meter movement?",Voltmeter,Power factor meter,Ammeter,Wattmeter,C
805,Which of the listed pressure control valves would be used to permit the completion of one action of a hydraulic system before a second action would be permitted?,Counterbalance valve,Unloading valve,Sequence valve,Pressure-reducing valve,C
806,Which of the listed procedures should be carried out to prevent moisture damage to electrical apparatus during extended periods of idleness?,Fill the motor housing with CO2 to inert the space.,Strap silica gel around the commutator.,Place heat lamps in the motor housings.,Cover the equipment with a canvas tarpaulin.,C
807,Which of the listed transformers uses a single winding to produce voltage transformation?,Step-up transformers,Step-down transformers,Autotransformers,Isolation transformers,C
808,Which of the listed transformers uses a single winding to produce voltage transformation?,Stepup transformers,Stepdown transformers,Autotransformers,Isolation transformers,C
809,Which of the terms listed best describes a compound-wound DC generator having a higher voltage at no load than at full load?,Flat compounded,Over compounded,Under compounded,Terminal compounded,C
810,Which of the terms listed best describes a compound-wound DC generator having a higher voltage at no load than at full load?,Flat compounded,Over compounded,Under compounded,Terminal compounded,C
811,"While on watch in the engine room, you are setting up to parallel alternators. The switchboard has a synchroscope and synchonizing lamps. If the synchoscope is broken, which of the steps listed is the most essential before an alternator can be paralleled ",The breaker should be closed when one synchonizing lamp is dark and the other is bright.,The breaker should be closed when both synchronizing lamps are bright.,The frequency meter should be used to determine that the incoming alternator frequency is slightly higher than the bus.,A portable phase sequence  indicator must be used to verify the infomation from the lamps.,C
812,"While paralleling two alternators, the synchronizing lamps remain lit as the synchroscope pointer approaches the 0°.  This would indicate that the__________.",incoming alternator is running too fast,alternator voltages are equal,synchroscope is defective or broken,alternator power factors are in phase,C
813,"While paralleling two alternators, the synchronizing lamps remain lit as the synchroscope pointer approches the 0°.  This would indicate that the__________.",Normal charging circuit,alternator voltages are equal,synchroscope is defective or broken,alternator power factors are in phase,C
814,"While troubleshooting a circuit in an engine room central control console, a resistor is suspected of being faulty. Which of the following precautions must be observed if an ohmmeter is to be used to check its value?",Correct polarity must be observed because reverse bias will damage the component.,Meter leads must not be twisted so as to cancel out the individual magnetic fields.,Resistor's circuit must be de-energized and at least one end of the component isolated.,The meter case must be grounded prior to attaching the leads.,C
815,Wht is the main difference between a relay and contractor?,"contractors control current,relay control voltage"," a relay is series connencted,  a contractor is parallel connected",contractors can handled heavies loads than relays,"contractors are made from silver, relays are made from copper",C
816,Why are transformer aboard ship used with AC generators?,to decrease power output,to increase power output,to permit higher voltage for motor operation and low voltage for lighting circuits,to change frequency,C
817,With two alternators is on parallel. An increased load on one will_____________.,run the other as the motor,increase the speed of the other,cause the armature current to lag on the one,have no effect on the other,C
818,You are attempting to parallel to two AC generators and the synchroscope pointer stops at a position other than 0 degrees. What will happen if you close the circuit breaker at this moment?,the incoming machine will accept all the load,the incoming machine will trip out on low voltage release,a hazardous condition will be created by the cross current between the machine,a hazardous will be created by the incoming machine being at a higher frequency than the bus,C
819,You are attempting to parallel two AC generators and the synchroscope pointer is revolving slowly in the fast direction.  You should __________.,use the governor control switch to adjust the incoming voltage so it is equal to the bus voltage,use the governor control switch to increase the speed of the machine on the line only,close the circuit breaker when the synchroscope pointer approaches the 0° position,use the field rheostat to adjust the speed of the incoming  machine,C
820,"You are attempting to parallel two AC generators, and the synchroscope pointer is revolving slowly in the fast direction. You should____.",Use the governor control switch to adjust the incoming voltage so it is equal to the bus voltage,Use the governor control switch to increase the speed of the machine on the line only,close the circuit breaker when the synchroscope pointer is at the 0 degree,use the field rheostat to adjust the speed of the incoming machine,C
821,The communication system being used onboard that are not affected by electrical interferences are                             . I - Radio  II - Telex  III - Facsimile,I and II,I and III,II and III,"I, II, and III",C 
822,A 120 volt battery is rated at 800 amp-hours for a continuous 50 kW load.  Approximately how long will the fully charged battery be able to supply a continuous 50 kW load before the battery rating is exceeded?,60 minutes,75 minutes,90 minutes,115 minutes,D
823,"A 12-volt battery is connected to parallel arrangement of a three-ohm, a two ohm and a six ohm resistor. What is the total resistance?",2 amps,4 amps,6 amps,12 amps,D
824,A Bourdon tube-type steam pressure gage is fitted with a siphon loop to prevent damage from the direct effects of __________.,pressure shock,uneven expansion,entering condensate,entering steam,D
825,A burned-out LED should be indicated by __________.,excessive output,a slight glow in the crystal,excessive illumination,no illumination,D
826,A degree of control cover over the speed of slip ring induction motor cn be obtained ,adjusting governor linkage,changing the number of phases to the motor,inserting resistance into the stator circuit,inserting resistance into the rotor circuit,D
827,A device which prints out a permanent record of the plant operating conditions is known as the __________.,analogger,bell logger,alarm logger,data logger,D
828,A ground in an electrical circuit outside the engine room __________.,cannot be detected under normal conditions,is of no consequence to engineering personnel,is indicated at the branch circuit breaker panel,is indicated by the ground detecting lamps on the main switchboard,D
829,A grounded field coil in an AC motor can be tested by a/an____________.,portable growler,galvanometer ,visual inspection,megohmmeter,D
830,A hydrometer indicates specific gravity by comparing the __________.,density of a substance in water with the density of the same substance in air,differences in weight between water and the mass of the liquid being measured,mass of substance measured with the density of the same substance,buoyancy of an object in water with the buoyancy of the same object in the liquid being measured,D
831,A lamp has a source voltage of 110 volts and a current of 0.9 amps.  What is the resistance of the lamp?,0.008 ohms,0.08 ohms,12.22 ohms,122.22 ohms,D
832,A lead-acid battery is considered fully charged when the __________.,electrolyte gasses freely,battery charger ammeter indicates a positive reading,terminal voltage reaches a constant value at a given temperature,specific gravity of all cells reaches the correct value and no longer increases over a period of 1 to 4 hours,D
833,A low voltage protection device is used on motor starting equipment to_______________.,trip circuit contractor when the motor overspeed due to low voltage,trip circuit contractors when the motor develops a short circuit,allow the motor to restart automatically on restoration voltage without manually resetting ,prevent the motor from restarting automatically,D
834,A low voltage reading on a bar to bar test indicates____________.,An open ,a short  ,a ground,a close,D
835,A millimeter with a full scale deflectionn reading  of 100 miliamperes has an accuracy of + or -2%. A meter reading of 10 milliamperes would indicate a line current between:,the electrical current exceeds the rated value of the fuse,9.0 and 10.0 milliamperes,9.8 10.0 miliamperes,8.0 and 12.0 milliamperes,D
836,A resistor placed in parallel to the output of a power supply __________.,is a temperature compensator,corrects power factor,prevents excessive currents,aids in output voltage regulation,D
837,"A series wound DC motor has its armature and field connected in series with a resistor.  When the motor is disconnected  from its power supply, this motor will exemplify __________.",the proper connections for across the line starting,the proper connections for an automatic strip heater,a reversing controller circuit,dynamic braking,D
838,A shaded-pole motor is classified as a __________.,synchronous motor,three-phase induction motor,DC compound-wound motor,single-phase induction motor,D
839,A shore power circuit breaker should be closed only __________.,when the ship's generators have been directly paralleled to those on shore,in a shipyard,if a quick disconnect coupling is used,when the ship's generators have been removed from the bus,D
840,A short in a DC motor would be detected by____________.,brush sparking,ground lights,blackened bars,vibration,D
841,A signal derived from a controlled function and returned to the initiating point is called a/an. ,electromagnet, Inverse signal, Reverse signal, Feedback signal,D
842,"A split-phase induction squirrel-cage motor will not come up to speed, even though the rated voltage, rated frequency, and rated load are applied.  The suspected trouble could be due to __________.",a faulty centrifugal switch,broken rotor bars,worn bearings,all of the above,D
843,"A switchboard, for a AC electrical distribution system, will be provided with which of the following components?",Frequency meter.,Ammeter,Voltmeter,All of the above,D
844,"A three-phase alternator is operating at 450 volts with the switchboard ammeter reading 300 amps. The KW meter reads 163.6 KW, meter reading would increase by _________.", 37.8 KW, 17.8 KW, 30.6 KW, 23.4 KW,D
845,"A turbo generator has a rated output of 1200 KW at 60 Hertz, with a no load frequency of 61.5 Hertz.  What is its speed  droop?",1.025%,1.500%,2.439%,2.500%,D
846,A voltmeter is connected in a circuit in_____________.,relay ,series,series parallel,parallel,D
847,A volt-ohm-milliammeter can be used to check for _______.                   I - Continuity            II - Grounds               III - Voltage,constant speed results, I and III, I and II," I, II and III",D
848,"Aboard ship, a grounded field coil in an AC motor can be determined by using a __________.",portable growler,galvanometer,visual inspection,megohmmeter,D
849,Air gap readings should be periodicly taken for electrical generation equipment.  The best tool to use to take these measurements is a __________.,cloth (non-metalic) tape measure,dial indicator,inside micrometer,"tapered, long blade, feeler gage",D
850,"Alternating current circuits develop resistance, inductance, and capacitance.  The capacitance of individual capacitors  is expressed in __________.",ohms,mhos,henrys,farads,D
851,An AC generator operating in parallel loses its excitation without tripping the circuit breaker.  This will __________.,not affect the faulty generator due to the compensation of  the other generators,cause the slip rings to melt,increase the output amperage between the armature and the bus,cause high currents to be induced in the field windings,D
852,"An AC generator operating in parallel, loses its excitation and the generators circuit breaker fails to trip will_____________.",continuity,cause the slip rings to melt,cause low voltage differential between the armature and the bus,cause high currents to be induced in the field windings,D
853,"An AC generator produces 60 Hz at 1800 RPM. If the generator speed is increased to 1830 RPM, what will happen to the cycle?",the power being consumed by electrical equipment,increase to 61Hz,decrease to 59 Hz,increase to 63 Hz,D
854,An across-the-line starter is typically used for which of the following applications?,Reduced-current starting of large motors,Low torque starting of small motors,Low resistance starting of DC motors,Full-voltage starting of motors,D
855,An alternator will fail to develop its rated voltage if_______________.,it is not up to frequency,there is no excitation,the governor is malfunction,all of the given answers,D
856,An alternator will fail to produce line voltage as a result of __________.,a closed circuit breaker,oxidized slip rings,improperly staggered brushes,excitation field failure,D
857,"An electric circuit connected in a series with R1=4ohms, R2=3ohms, R3=4ohms, compute the total voltage of the current having 15 amperes?", 110 volts, 420 volts, 380 volts, 240 volts,D
858,An electric generator in which the magnetic flux is provided by one more permanent magnets _________., magnetic flux generator, flux generator, permanent magnet generator, magneto-electric generator,D
859,An electric generator in which the magnetic flux is provided by one more permanent magnets _________., magnetic flux generator, flux generator, permanent magnet generator, magneto-electric generator,D
860,An electric heating element supplied with 120 volts draws 15 amps.  How much power will be consumed?,15 watts,45.57 watts,8 watts,1800 watts,D
861,An electrical device which prevents an action from occurring until all other required conditions are met is called a/an __________.,limit,monitor,VESSELlator,interlock,D
862,"An equalizing connection between two compound-wound DC generators when paralleled, serves to __________.",reverse the polarity of the incoming generator as the series field weakens,automatically equalize the power factors,reverse the direction of current in the series field of the incoming generator,parallel the series fields of the generators,D
863,"An open shunt field in a direct current machine may be located by connecting the field circuit to an external power source, equal to the rated field voltage or less, and tested with a voltmeter from _______.",any suitable ground to any available line lead, any field pole to each field coil lead, one field coil to each adjacent filed coil in turn, One line terminal to each coil lead succession,D
864,Before using rubber gloves when working on high voltage equipment the gloves should be ________., brand new, cleaned inside out, oiled inside and out, tested t withstand the high voltage,D
865,"Before you touch a small capacitor which is connected to a de-energized circuit, or which disconnected entirely, you should_____________.",gently tap it with a screwdriver,tag it with a de-energized tag,be equipment with an insulated fuse puller,short circuit the terminals to make sure that all the capacitors is discharged,D
866,Brushless generators are designed to operate without the use of __________.,brushes,slip rings,commutators,all of the above,D
867,D.C. motor brush adjustment includes attention to __________.,angle with the commutator and clearance within the holder,brush length and pigtail tightness,grade of material and surface dirt conditions,all of the above,D
868,Discharge switches are often located on hand-driven meggers. The purpose of these switches is to discharge capacitive charges stored in the __________.,megger hand generator,megger movement coils,tested equipment while conducting test,tested equipment after testing,D
869,"During the operation of the device shown in the illustration, the required compressed air output has stabilized within a pressure range of 100-110 psi. Which of the following statements of operating conditions is correct?","Component ""B"" is closed and will open when output pressure had dropped below 50 psi.","Component ""D"" is open and will close when output pressure  rises above 110 psi.","Component ""F"" will force ""E"" to be driven to the full open position.","Component ""E"" is VESSELlated proportionally in response to the required output.",D
870,Electrical insulation is classed by the __________.,International Association of Electrical Manufacturers,approximate operating voltage and current expected,U.S. Coast Guard,temperature stability of the manufacturing material(s),D
871,Electrical power is expressed in ______________., Holds insulation together well,volts,amps,watts,D
872,Equal power factors on parallel AC generator are maintained by an automatic____________.,governor control switch ,reverse power relay,reverse current relay,Voltage regulator,D
873,Fuses are rated in __________.,voltage,amperage,interrupting capacity,all the above,D
874,Generators are designed for an ambient temperature of___________________.,75 C,100 F,50,150 F,D
875,Grounds occurring in electrical machinery as a result of insulation failure may result from __________.,deterioration through extended use,excessive heat,extended periods of vibration,all of the above,D
876,How does an ohmmeter behave if its positive lead is connected to cathode of a diode while negative to anode?, has very low resistance,has decreasing resistance, has unstable resistance,has infinite high resistance,D
877,Hydraulic system reservoirs should be maintained at recommended normal levels to reduce __________.,condensation on inside walls,heat retention of working fluid,frequency of fluid changeover,all of the above,D
878,If a lead-acid battery is left in a discharged condition from a long period of time?, the electrolyte sulfuric acid will change to lead sulfate,the concentrated sulfuric acid will attack the lead peroxide plates,the separator will harder,the battery be unable to accept a full change,D
879,"If a magnetic controller contactor fails to pick up when the coil voltage is applied to the contactor coil, the cause may be __________.",overload,misalignment of the affected contactor contacts,low spring pressure,an open contactor coil,D
880,If an induction motor is run at 90% rated voltage,there would be an increase in starting torque,starting current would increased slightly,synchronous speed would decrease slightly,the slip would increase,D
881,If deck machinery is expected to be idle for an extended period of time you should____________.,have electrical safety gloves available in case of electrical shock before running,perform a 'high pot' test to determine the condition of the insulation,water wash the motor and controller to remove any salt that may interfere with smooth operation,check run at regular intervals to insure correct operation and to renew the internal coating of lubrication,D
882,"If the hydraulic compression type tubing fitting, shown as figure ""C"" in the illustration begins to leak, you should  __________.",apply more thread seal and retighten part 'IV',"apply thread seal tape around the threads between part ""II"" and 'IV', then reassemble and tighten","replace part ""III""","replace part ""I""",D
883,"If you reverse both the field and the armature connections  to a DC propulsion motor, __________.",the direction of motor rotation will change,the brushes will become overheated,a magnetic lock will occur in the motor,the direction of motor rotation will remain the same,D
884,"In a DC lighting circuit, 240 volts is reduced to 120 volts by the use of a___________.",a high commutator bar,step-down transformer,converter,balance coil,D
885,"In a series circuit, the entire source voltage will drop across ____________.",the resistor next to the negative terminal,a short circuit,the resistor next to the positive terminal,an open circuit,D
886,"In accordance with Coast Guard Regulations (46 CFR), receptacles for refrigerated containers must __________.",have a switch near the receptacles that disconnects all power to those receptacles,have a sign stating that the switch should be opened before cables are disconnected from the receptacles,be designed for circuit breaking service,all of the above,D
887,"In an automated pneumatic control system, increasing or decreasing the loading pressure by a set amount is called                                    .",Positioning,Proportioning,Controlling,Blasing,D
888,"In an electromagnetic slip coupling, the slip __________.",reduces magnetic pull caused by non-concentric electromagnets,reduces resonance and accentuates the turning moment irregularities,transmits electromagnetic flux through the primary circuit,generates the low frequency current which excites the secondary electromagnet,D
889,"In the contineous machinery survey, how many year/s interval is needed so that all machineries and equipment will be surveyed and manitained properly?",1,2,4,5,D
890,"In troubleshooting a circuit in a console, you find that a  resistor may be faulty.  Which of the precautions listed must be observed when using an ohmmeter to carry out this test?","Correct polarity must be observed, connecting the red lead  to the banded end of the resistor.",Meter leads must be twisted to cancel the leads' magnetic fields.,The meter must be placed in series with the resistor and the circuit.,The resistor's circuit must be de-energized and at least one end of the component isolated.,D
891,"Increased internal leakage, in addition to poor hydraulic system response, and inadequate lubrication, is the result  of __________.",pump bearings in poor condition,excessively worn actuator-piston packing,broken directional control valve centering springs,low hydraulic oil viscosity,D
892,Inductance is measured in unit_________________.,ohms ,coulomb,farad,henry,D
893,It is a kind of electric device connected into the field circuit for the purpose of adjusting the output voltage to the value at which it is required to the maintained.,Breaker,Relay ,Regulator,Rheostat,D
894,It is a type of transformer where the high voltage winding is entirely being wound over the top of the low voltage winding.,Conventional,H-type,Core,Shell,D
895,It is an electric instrument used to measure the rate at which charges move through a material.,Voltmeter,Ohmmeter,Wattmeter,Ammeter,D
896,It is an electrical instrument used in measuring high resistance in high voltage electrical circuit.,Eddy,Ammeter,potentiometer,ohmmeter,D
897,It is safety gadget to use when testing the specific gravity of storage battery water.,Safety shoes,Long sleeves coverall,Safety goggles,Rubber handgloves,D
898,It is the change in voltage from no load to full load.,Voltage Drop,Voltage Decrease,Voltage Increase,Voltage Regulation,D
899,It is the measure of the free electrons movement thru a material in a wet battery.,coulomb,Resistance,Voltage,Current,D
900,It is the part of an alternating current generator that carries the generator alternating current to the load.,Armature, Commutator ,Carbon brush,Ship rings,D
901,Local action in a nickel-cadmium battery is offset by __________.,separating the positive and negative plates with plastic spacers,separating the positive and negative plates with resin impregnated spacers,adding a small amount of lithium hydroxide to the electrolyte,trickle charging,D
902,Motor controllers are seldom troubled by grounds because __________.,cabinet heaters always keep internal components dry,special insulation is used on wire for vital circuits,shock mounts on controller panels greatly reduce vibration,contactors and relays are mounted on nonconducting panels,D
903,"On some electrical generating equipment one outboard bearing pedestal is insulated from the bedplate. This should be checked with a millivolt meter and a jumper. With the millivolt meter connected between the shaft and the bedplate, how should the jumper ",It should be placed from one end of the shaft to the other to eliminate shaft currents.,It is used to short the + and - in a D.C. generator or Phase A and Phase C in an alternator to eliminate the effects of CEMF.,It should be placed across the insulating block to increase the shaft current to a point where it can be measured with the millivolt meter.,"It should be placed from the shaft to the pedestal while one reading is taken, then removed to take a second reading.  This eliminates the insulating effect of the bearing.",D
904,"One diode of a single phase, center tap, full-wave rectifier has burned out in a shorted condition. Therefore, the output will be __________.",zero,a rectified half-wave,a rectified full-wave,equal to the AC input,D
905,One function provided by a hydraulic accumulator is to __________.,provide an area where air can separate from the oil,provide an area to separate solid contaminants from the oil,act as an oil and water separator,absorb shocks occurring in the system,D
906,One of the generator bearing shells is generally insulated  from the end housing in order to prevent __________.,rapid brush wear,residual magnetism leak off,excessive field winding heat,circulation of shaft currents,D
907,Power transformer are rated in ___________.,kilowatts,ampere-turns,kilowatt-volts,kilovolt-amperes,D
