243,Which of the following statements concerning a simple parallel resistance circuit is correct?,The voltage drop across each resistor is the same.,The total current flow equals the reciprocal of the sum of  the individual currents.,The total resistance equals the sum of the individual resistances.,The total voltage equals the sum of the individual voltages across each resistance.,A
244,Which of the following statements concerning analog and digital devices are correct?,"The variables in digital systems are fixed quantities, and the variables in analog systems are continuous quantities.",There are no basic differences between the two systems.,Analog devices are superior in accuracy compared to digital devices.,Operations in a digital device are performed simultaneously.,A
245,Which of the following statements concerning electrical cables is correct?,"Where they pass through watertight bulkheads, they should be fitted with watertight stuffing boxes.",Electric cable coverings should never be grounded.,"Electrical cables must be rigidly held in place by welding  of armored cable, or glued in place where nonmetallic insulation is used.",All of the above.,A
246,Which of the following statements concerning nickel-cadmium batteries is true?,Nickel-cadmium batteries are less susceptible to local action than lead-acid batteries.,Nickel-cadmium batteries should only be discharged 50% before recharging.,The electrolyte of an idle nickel-cadmium battery must be replaced monthly to maintain battery condition.,When mixing electrolyte always add acid to the water.,A
247,Which of the following statements describes the effects of  ambient temperature on local action within lead-acid storage batteries?,Increasing ambient temperature increases local action.,Increasing ambient temperature decreases local action.,Ambient temperature has no effect on local action.,At 90°F all local action virtually ceases.,A
248,Which of the following statements is time if a 100 watt lamp and a 75 watt lamp are connected in parallel across a 100 volt power supply?, the 75 watt lamp will have a higher resistance, the 100 watt lamp will have a greater resistance, the 75 watt lamp will draw as much current as the 10 watt lamp, current flow will be the same across each lamp,A
249,Which of the following statements is time if a 100 watt lamp and a 75 watt lamp are connected in parallel across a 100 volt power supply?, the 75 watt lamp will have a higher resistance, the 100 watt lamp will have a greater resistance, the 75 watt lamp will draw as much current as the 10 watt lamp, current flow will be the same across each lamp,A
250,Which of the following statements is true concerning a large polyphase synchronous main propulsion motor?,The motor is started as an induction motor.,Resistance is gradually added to the rotor circuit.,The starting current is held below the rated current.,The field winding is energized for starting purposes only.,A
251,Which of the following statements is true concerning all three-phase alternators?,Each has three separate but identical armature windings acted on by one system of rotating magnets.,Each has one armature winding acted on by three identical but separate systems of rotating magnets.,All three-phase alternators are designed to operate with a  0.8 leading power factor.,The three phases always provide power to the load through three sets of slip rings and brushes.,A
252,Which of the following statements is true concerning simple parallel resistance circuits?,The total current flow equals the sum of the individual currents.,The total current flow equals the reciprocal of the sum of  the individual currents.,The total resistance equals the sum of the individual resistance.,The total voltage equals the sum of the individual voltages across each resistance.,A
253,Which of the following statements is true concerning simple parallel resistance circuits?,The total current flow equals the sum of the individual currents.,The total current flow equals the reciprocal of the sum of  the individual currents.,The total resistance equals the sum of the individual resistance.,The total voltage equals the sum of the individual voltages across each resistance.,A
254,Which of the following statements is true concerning the operation of two alternators in parallel?,The cycles per second of each alternator are the same.,Both alternator governors must be set with the same amount  of speed droop.,The number of field poles must be the same on each  alternator.,The load must always be divided equally between alternators.,A
255,Which of the following statements is true concerning the operation of two alternators in parallel?,The cycles per second of each alternator are the same.,Both alternator governors must be set with the same amount  of speed droop.,The number of field poles must be the same on each  alternator.,The load must always be divided equally between alternators.,A
256,Which of the following statements regarding the use of a current measuring instrument is correct?,It must be connected in series with the circuit.,You should always start with the lowest range until a suitable reading is obtained.,The indicating needle is deflected from left to right regardless of polarity.,An external shunt is generally utilized where current is less than 10 amperes.,A
257,Which of the following statements represents an application of a silicon controlled rectifier?,Provides DC power for a main propulsion motor.,Used as a voltage reference diode.,Used in photo cell sensor circuits for boiler burners.,Used to eliminate AC power supply hum.,A
258,Which of the following statements represents an application of a silicon controlled rectifier?,Provides DC power for a main propulsion motor.,Used as a voltage reference diode.,Used in photo cell sensor circuits for boiler burners.,Used to eliminate AC power supply hum.,A
259,Which of the following statements represents the FIRST step in seating new brushes on slip rings?,Lay sandpaper between the brush and the slip ring and slide the sandpaper back and forth under the brush.,Press the brushes against the slip ring with a wood block.,Increase brush pressure and run at no load for 3 to 4 hours.,Apply seating compound under the brushes and run at no load for 2 hours.,A
260,Which of the following statements represents the important factor that must be considered when replacing a faulty diode in a generators excitation field rectifier assembly?,Be certain that the replacement diode is installed with the same polarity as the one removed.,Never alter the diode alignment to cause a change in the neutral plane.,Replacement of a diode also requires balancing of the rotor with a one-piece rotor lamination to be shrunk fit and keyed to the shaft.,The replacement diode must be dipped in varnish prior to installation to protect against humidity.,A
261,Which of the following substances should be applied to battery terminals to prevent corrosion?,zinc chromate,naval jelly,lead peroxide,petroleum jelly,A
262,Which of the following transformer uses single windings to produce voltage transformation?, autotransformers ,isolation transformer,step up transformer,step down transformer,A
263,Which of the formulas listed is correct for determining power?,P = (E)(E)/R,P = (I)(R)(R),P = (I)(I)/R,P = E/R,A
264,Which of the formulas listed is correct for determining power?,P = (E)(E)/R,P = (I)(R)(R),P = (I)(I)/R,P = E/R,A
265,Which of the instruments listed should always be connected  in series with a circuit?,Ammeter,Megohmmeter,Wattmeter,Voltmeter,A
266,Which of the listed conditions could cause a recently overhauled DC motor to have excessively hot windings and sparking at the brushes?,the oily water separator is de-energized,High bar-to-bar voltage,Loose brushes,Excessive humidity,A
267,Which of the listed conditions could cause a recently overhauled DC motor to have excessively hot windings and sparking at the brushes?,like poles repel each other,Low series field current,High shunt field current,Excessive humidity,A
268,Which of the listed conditions could cause a recently overhauled DC motor to have excessively hot windings and sparking at the brushes?,the oily water separator is de-energized,High bar-to-bar voltage,Loose brushes,Excessive humidity,A
269,Which of the listed conditions will occur if dirt and grease are allowed to accumulate between the commutator segments of a motor?,A partial short circuit.,A dead short circuit.,Misalignment of the motor shaft.,Over speeding of the motor.,A
270,Which of the listed devices is used to measure pressure and convert it to an electrical signal?,Transducer,Reducer,Transformer,Rectifier,A
271,Which of the listed devices would be installed at a control system air pressure reducing station?,Moisture separator,Vacuum breaker,Lubricator,Nonreturn valve,A
272,Which of the listed governor operating characteristics is considered to be isochronous?,Zero speed droop,Positive speed droop,Negative speed droop,Varying speed droop,A
273,"Which of the listed motors will operate at the highest RPM, assuming that each operates at the same frequency?",A four-pole synchronous motor under normal load.,A four-pole induction motor under no load.,A six-pole synchronous motor under normal load.,A six-pole induction motor under full load.,A
274,Which of the listed pairs of materials make the best insulators?, Glass and mica,Doped silicon and germanium, Dry and a vacuum, Copper and aluminum,A
275,Which of the listed procedures is the best way to tell if a motor has become overloaded?,Measure the current flow and compare it with the motor full load current flow as shown on the nameplate.,Feel the motor and judge by the temperature.,Watch for telltale signs of smoke coming from the motor.,Periodic opening of the O/L relay coil,A
276,Which of the problems listed will occur if a lead-acid battery is allowed to remain in a discharged condition for a long period of time?,The battery may be unable to accept a full charge.,The electrolyte will change to lead sulfate.,The concentrated sulfuric acid will attack the lead peroxide plates.,The separators will harden.,A
277,Which of the problems listed will occur if a lead-acid battery is allowed to remain in a discharged condition for a long period of time?,The battery may be unable to accept a full charge.,The electrolyte will change to lead sulfate.,The concentrated sulfuric acid will attack the lead peroxide plates.,The separators will harden.,A
278,Which of the spaces listed is defined as a 'location requiring an exceptional degree of protection' when considering the installation of shipboard electrical equipment?,Machinery space,Chart room,Console room,Accommodation space,A
279,Which of the spaces listed is defined as a 'location requiring an exceptional degree of protection' when considering the installation of shipboard electrical equipment?,Machinery space,Chart room,Console room,Accommodation space,A
280,Which of the valves listed is NOT considered to be a hydraulic system directional control valve?,Sequencing valve,Two-position valve,Three-position valve,Spring-centered valve,A
281,Which statement is true concerning maritime safety regulation for cable splicing?, Cables may be spliced to extend circuits in vessels being altered, Cables in one sub-assembly may not be spliced to cables in another sub-assembly, Cables of large size or exceptional length may never be spliced, All of the given answers,A
282,Which type of AC single phase motor will also operate on direct current?,split phase,series,shaded pole,repulsion-start,A
283,Which type of generator will most likely lose its voltage over a range of 60% to 125% of full load?,Under compounded,Flat-compounded,over compounded,combination compounded,A
284,"While starting a hydraulic anchor windlass, you observe that hydraulic pressure does not develop in spite of the proper  operation of the electric drive motor.  Which of the following actions should you take FIRST to restore pressure?",VESSELlator,Inspect the disc brake on the electric motor for proper operation.,Check the electric motor for an open overload relay contact.,Check for full voltage supply to the electric motor.,A
285,"While underway onboard a DC diesel-electric drive ship, you notice excessive sparking of the brushes on the main propulsion motor.  You should first __________.",notify the bridge that you will need to slow down,decrease the speed of the main generator,decrease the main generator voltage,decrease the motor field current,A
286,"While you are  starting a main populsion synchronous motor as an inductor motor , the ampere meter pegs out  a maximum and then returns to the proper value synchronization,this means the:",motor has started properly,field winding are grounded,slip rings are dirty,power transmission cables grounded,A
287,"While you are starting a main propulsion synchronous motor as an induction motor, the ampere meter pegs out at maximum and then returns to the proper value after synchronization. This means the:",motor has started properly,field windings are grounded,slip rings are dirty,power transmission cables are grounded,A
288,Why is it desirable to operate paralleled AC generators at the same power factor?,circulating currents are kept to a minimum,field excitation losses are kept to a minimum, generators governors are less likely to hunt, all of these choices,A
289,"With an increase in load on a flat-compounded D.C. generator, the voltage will:",remain the same,decrease,increase,reduce to half,A
290,"With both ends of a three conductor cable disconnected and  arranged without the conductors touching each other, an ohmmeter reading of 'zero' ohms between the ends of one conductor would indicate __________.",continuity,a partial ground,the resistance is infinite,a short circuit,A
291,"You are attempting to parallel two AC generators, and the synchroscope pointer is revolving in the fast direction. This indicates that the frequency of the incoming machine is __________.",higher than the bus frequency,lower than the bus frequency,the same as the bus frequency but out of phase with it,the same as the bus frequency and the circuit breaker may be closed at any pointer position,A
292,"You are calibrating a multimeter using internal batteries to supply power for resistance measurements. However, you are  unable to adjust the pointer to 'zero' using the adjustment knob.  Therefore, you should __________.",replace the batteries in the instrument,measure resistance by dividing the voltmeter indication by  the ammeter indication,set the pointer using a bridge,change scales to the R X 100 scale and adjust using the 'zero ohms' adjusting knob,A
293,"You are calibrating a multimeter using internal batteries to supply the power for resistance measurements. However, you are unable to adjust the pointer to ""zero"" using the adjustment knob. Therefore, you should _______.", Replace the batteries in the instruments, Measure resistance by dividing the voltmeter indication by the ammeter indication, Set the pointer using a bridge," Change scales to the R x 100 scale and adjust the ""zero ohms"" adjusting knob",A
294,You are in the process of paralleling two AC generators and the synchroscope pointer has stopped at a position other than 0°.    This indicates that  __________.,the frequency of the incoming machine is the same as the bus frequency,"the incoming machine is in phase with the bus, but the frequency is not the same",the circuit breaker needs to be reset,there is an existing cross current between generators,A
295,"You are testing the insulation in an AC generator with a megohmeter.  The resistance value of a dry, clean winding will __________.","continue to rise as the test potential is maintained, becoming fairly steady as the leakage current stabilizes",remain constant as the temperature of the windings increases,"continue to drop as the potential is maintained, becoming fairly steady after 5 to 7 minutes",stabilize after approximately 2 to 4 minutes of fluctuation,A
296,"You are testing the insulation in an AC generator with a megohmeter.  The resistance value of a dry, clean winding will __________.","continue to rise as the test potential is maintained, becoming fairly steady as the leakage current stabilizes",remain constant as the temperature of the windings increases,"continue to drop as the potential is maintained, becoming fairly steady after 5 to 7 minutes",stabilize after approximately 2 to 4 minutes of fluctuation,A
297,You can determine if a circuit breaker is tripped by __________.,examining the position of the handle,checking for the warm breaker,looking for a burned-out link,looking for the tripped breaker light,A
298,A  microprocessor is:,another name for a computer,a CPU integrated circuit,a name for a calculator,a small scale intergrated circuit,B
299,A 4160 Volt AC generator is loaded to 2850 kW with a 0.85 power factor.  What is the approximate kVAR load on the generator?,503 kVAR,1766 kVAR,2850 kVAR,3353 kVAR,B
300,A 9 ampere current is flowing in a resistor of 20 ohms. If another 40 ohms resistor will be connected in parallel how many amperes will be flowing on it?,9,3,12,6,B
301,A bus disconnect link is used to isolate __________.,one bus bar from the ground detection system,the generator circuit breaker from the bus,different bus phases from the equalizer connection,positive and negative buses from the neutral,B
302,A capacitor discolored due to excessive heat should be __________.,calibrated,replaced,cooled,soldered,B
303,"A capacitor is to be tested with a megohmmeter. If the meter is connected to a shorted capacitor, the meter pointer should __________.",immediately swing to the maximum resistance value,deflect to zero and remain at that position,swing to a high reading and gradually decrease,swing to zero then gradually increase with slight pointer movements down scale,B
304,A characteristic of an induction motor with a low resistance rotor winding is __________.,high starting voltage,high starting current,high slippage,low starting voltage,B
305,A characteristic of DC power system and controls is____________.,low weight,high motor starting torque ,low maintenance,simplified design,B
306,A circuit breaker and a fuse have a basic similarity in that they both __________.,can be reset to energize the circuit,should open the circuit when overloaded,will burn out when an over current flow develops,all of the above,B
307,A circuit in which a fuse has blown would be considered as a__________________.,short circuit,open circuit,boarded circuit,grounded circuit,B
308,A common type of protective covering used on electrical conductors_____________.,plain ground,fibrous braid,silver sheathing,babbit sheathing,B
309,A current-carrying conductor making electrical contact with a wiring conduit will be indicated by a __________.,high switchboard wattmeter reading,totally dark switchboard ground detecting light,low switchboard wattmeter reading,all of the above,B
310,"A dashpot mechanism in a magnetic-type, time-delay overload relay, functions to _______.", contain the arc-quenching insulating oil around the relay contacts,prevent the relay from operating when normally large setting currents are encountered,prevent mechanical damage to relay by dampening the abrupt movement of the relay contacts," delay, contact separation by speeding current flow through the magnetic coil",B
311,"A device used in an electrical circuit to change alternating current to direct current, is known as a __________.",current transformer,rectifier,condenser,shunt,B
312,A direct current passing through a wire coiled around a soft iron core is the description of a simple __________.,magnetic shield,electromagnet,piezoelectric device,electromagnetic domain,B
313,"A full-wave rectifier has one diode burned out in an open condition, what will be the output characteristic of the device?",Zero,Half-wave rectified,Full-wave rectified,Equal to the AC input,B
314,A generator is prevented from becoming motorized by the use of a/an __________.,overspeed trip,reverse power relay,back pressure trip,governor controls,B
315,"A load with an impedance of 440 ohms is connected across the secondary of a step-up transformer.  If the input voltage is 110 VAC and the step-up ratio is 10, what will be the primary current?",2.5 amps,25 amps,250 amps,current cannot be determined with information given,B
316,A numbering system containing numbers and letters ________., digital, alphanumeric, analog, logic,B
317,A pneumercator tank gage utilizes __________.,a Bourdon tube indicator,a balance chamber,an electronic sensing line,all of the above,B
318,A salinity indicating system functions by measuring the___________.,electrical inductance of water,electrical conductivity of water,specific gravity of a water,hydrogen concentration,B
319,A saturable-core reactor operates on the principle of controlling a load winding's inductance by varying the core's __________.,dielectric,permeability,reactance,inductance,B
320,A semi-conductor is a material with a____________.,conductivity higher than a normal conductor,conductivity higher than a normal isolator,conductivity lower than a normal insulator ,high conductivity at low temperatures,B
321,"A single-phase induction motor starts, comes up to about 75% rated speed, slows down to a lower speed, and accelerates again.  The problem is most likely in the __________.",starting winding,running winding,starting capacitor,running centrifugal switch,B
322,a soft iron core with wire coiled amount it and a direct current passing through the wire is the description of a sample:,magnetic shield,electromagnet,piezo electrical device,electromagnetic domain,B
323,A suspected 'open' in a motor field winding can be tested by using  a/an __________.,potentiometer,ohmmeter,wattmeter,ammeter,B
324,"A three-phase, induction-type motor experiences an open in  one phase.  Which of the listed automatic protective devices will prevent the machine from being damaged?",Overspeed trip,Thermal overload relay,Three-pole safety switch,Magnetic blowout coil,B
325,"A variable shunt, connected across the series field coils of a DC compound wound generator, to permit adjustment of the  degree of compounding, is called a __________.",divider,diverter,converter,rheostat,B
326,A voltage regulator for a DC generator has the function of_____________.,varying the resistance of the series field,varying the resistance of the shunt field,varying the resistance of the armature circuit,adjustment the governor mechanism,B
327,A waveform is used to display the level of direction of current and voltage. The waveform for the circuit displays the level and direction of the current and voltage for every instant of time for one full revolution of the armature is called __________., dual current, alternating current, direct current, linear current,B
328,"According to 46 CFR Part 58,  if a steering motor becomes overloaded, the __________.",overload condition of 5% will trip the motor off the line  immediately,overload condition will be indicated audibly and visually at the main machinery-control station.,motor running indicator will begin to flash 'on' and 'off' in response to the sustained overload condition,standby steering pump will start automatically and come on the line,B
329,Ambient temperature is the __________.,amount of temperature rise of an electric motor with no load,temperature of the compartment where the motor is located,"normal electric motor operating temperature, less the room temperature",actual temperature developed by an operating motor,B
330,Amortisseur windings are installed in a synchronous motor to ________.,eliminate arcing between the stator and the rotor,provide a means for starting,produce a higher power rating,reduce eddy current losses,B
331,An AC diesel generator incapable of being paralleled with  the main bus normally employs an isochronous governor in order to __________.,increase speed droop in proportion to load,maintain a frequency of 60 cycles per second,increase or decrease engine speed upon load demand,prevent attempts to parallel,B
332,An AC diesel-electric propulsion system requires less maintenance than a DC diesel-electric system for which one of the following components?,Diesel engine,Propulsion motor,AC generator,Propulsion transformers,B
333,"An AC generator power panel is fitted with two synchronizing lamps and a synchroscope.  When paralleling, if the synchroscope pointer is at the noon position and one synchronizing light is bright while the other remains dark, this indicates that _________", neutral,the generators are out of phase and one lamp is burned out,the generators are in phase but one lamp is burned out,the generator breaker may be closed,B
334,"An AC generator produces 60 Hz at 1800 RPM.  If the generator speed is increased to 1830 RPM, the cycles will __________.", acid,increase to 61 Hz,decrease to 59 Hz,increase to 63 Hz,B
335,"An accidental path of low resistance, allowing passage of abnormal amount of current is known as a/an __________.",open circuit,short circuit,polarized ground,ground reference point,B
336,"An adjustable resistor, whose resistance can be changed without opening the circuit in which it is connected, is called a __________.",bleeder resistor,rheostat,bridge,variable shunt strip,B
337,An arrangement of elements interconnected and interacting in such a way as to maintain or effect in a prescribe manner some condition of a body process or machine which flow of the system., Loop, Control system, Monitoring system, Detecting system,B
